{
  "schema_version": 2,
  "diagram_type": "workflow",
  "meta": {
    "title": "Agent Tool Call — Approval Walkthrough",
    "animation": "trace",
    "visual_preset": "signal-flow",
    "quality_profile": "showcase",
    "views": [
      {
        "id": "happy-path",
        "label": "Request to result",
        "focus": [
          "user",
          "chat",
          "planner",
          "router",
          "approval",
          "tool",
          "external",
          "final"
        ],
        "note": "Follow the successful request from user intent to the final reply."
      },
      {
        "id": "safety-gate",
        "label": "Policy and recovery",
        "focus": [
          "router",
          "approval",
          "blocked",
          "retry"
        ],
        "note": "See where risky work stops, waits for consent, or returns for revision."
      },
      {
        "id": "evidence-loop",
        "label": "Evidence and memory",
        "focus": [
          "external",
          "store",
          "trace"
        ],
        "note": "Isolate the durable trace and context path behind the visible answer."
      }
    ],
    "output": "examples/workflow-agent-tool-call-rendered.html",
    "walkthrough": {
      "title": "From prompt to gated tool call",
      "flow": "continuous",
      "steps": [
        {
          "id": "plan",
          "title": "A message becomes a plan",
          "body": "The user types into the chat surface. The planner turns the message into a plan and hands the next step to the tool router.",
          "focus": [
            "user",
            "chat",
            "planner",
            "router"
          ],
          "edges": [
            "request-chat",
            "plan-request",
            "planner-route"
          ],
          "state": [
            "plan ready"
          ]
        },
        {
          "id": "gate",
          "title": "Risky tools stop at the approval gate",
          "body": "The router asks whether this tool needs approval. Approved calls continue to the tool; denied calls are **blocked** and offered a retry path instead of failing silently.",
          "notes": [
            {
              "title": "Why a gate and not a filter",
              "body": "A gate is a visible decision with a person on one side. A filter is a silent drop nobody can audit."
            }
          ],
          "focus": [
            "router",
            "approval",
            "tool",
            "blocked",
            "retry"
          ],
          "edges": [
            "approval-check",
            "approved-tool",
            "approval-denied",
            "retry-request"
          ],
          "dim": [
            "user",
            "chat"
          ],
          "state": [
            "needs approval?"
          ]
        },
        {
          "id": "reply",
          "title": "The tool calls out, and evidence comes back",
          "body": "The tool call reaches the external API. Its reply becomes the final answer, and the result is recorded in the trace log alongside the context store's memory.",
          "focus": [
            "tool",
            "external",
            "final",
            "trace",
            "store"
          ],
          "edges": [
            "tool-external-call",
            "external-reply",
            "record-result",
            "write-trace-memory"
          ],
          "dim": [
            "user",
            "chat",
            "planner",
            "router",
            "approval"
          ],
          "state": [
            "reply sent",
            "trace written"
          ]
        }
      ]
    }
  },
  "lanes": [
    {
      "id": "ui",
      "label": "User Interface"
    },
    {
      "id": "agent",
      "label": "Agent Runtime"
    },
    {
      "id": "policy",
      "label": "Policy & Recovery",
      "variant": "exception"
    },
    {
      "id": "tools",
      "label": "Tool Execution & Evidence"
    }
  ],
  "phases": [
    {
      "id": "intake",
      "label": "Intake",
      "fromCol": 0,
      "toCol": 1
    },
    {
      "id": "reasoning",
      "label": "Plan + route",
      "fromCol": 2,
      "toCol": 3,
      "variant": "emphasis"
    },
    {
      "id": "execution",
      "label": "Execute + report",
      "fromCol": 4,
      "toCol": 5,
      "variant": "dashed"
    }
  ],
  "groups": [
    {
      "id": "agent_loop",
      "label": "Planning loop",
      "lane": "agent",
      "fromCol": 2,
      "toCol": 3,
      "variant": "emphasis"
    },
    {
      "id": "exception_path",
      "label": "Human or policy stop",
      "lane": "policy",
      "fromCol": 3,
      "toCol": 5,
      "variant": "security"
    },
    {
      "id": "evidence_path",
      "label": "Evidence path",
      "lane": "tools",
      "fromCol": 1,
      "toCol": 2,
      "variant": "dashed"
    },
    {
      "id": "tool_work",
      "label": "Tool work",
      "lane": "tools",
      "fromCol": 4,
      "toCol": 5,
      "variant": "dashed"
    }
  ],
  "mainPath": [
    "user",
    "chat",
    "planner",
    "router",
    "approval",
    "tool",
    "external",
    "final"
  ],
  "nodes": [
    {
      "id": "user",
      "lane": "ui",
      "col": 0,
      "type": "external",
      "label": "User",
      "sublabel": "asks for work",
      "width": 132
    },
    {
      "id": "chat",
      "lane": "ui",
      "col": 1,
      "type": "frontend",
      "label": "Chat Surface",
      "sublabel": "thread + files",
      "width": 132
    },
    {
      "id": "final",
      "lane": "ui",
      "col": 5,
      "type": "backend",
      "label": "Final Reply",
      "sublabel": "answer + changes",
      "width": 132
    },
    {
      "id": "planner",
      "lane": "agent",
      "col": 2,
      "type": "backend",
      "label": "Agent Planner",
      "sublabel": "plan next step",
      "tag": "context aware",
      "width": 132
    },
    {
      "id": "router",
      "lane": "agent",
      "col": 3,
      "type": "backend",
      "label": "Tool Router",
      "sublabel": "choose capability",
      "width": 132
    },
    {
      "id": "approval",
      "lane": "policy",
      "col": 3,
      "type": "security",
      "label": "Approval Gate",
      "sublabel": "scope + consent",
      "tag": "block risky ops",
      "width": 132
    },
    {
      "id": "blocked",
      "lane": "policy",
      "col": 4,
      "type": "security",
      "label": "Blocked",
      "sublabel": "wait or reject",
      "width": 132
    },
    {
      "id": "retry",
      "lane": "policy",
      "col": 5,
      "type": "messagebus",
      "label": "Retry Path",
      "sublabel": "revise request",
      "width": 132
    },
    {
      "id": "tool",
      "lane": "tools",
      "col": 4,
      "type": "messagebus",
      "label": "Tool Call",
      "sublabel": "shell / browser / MCP",
      "tag": "structured result",
      "width": 132
    },
    {
      "id": "external",
      "lane": "tools",
      "col": 5,
      "type": "cloud",
      "label": "External API",
      "sublabel": "network service",
      "width": 132
    },
    {
      "id": "store",
      "lane": "tools",
      "col": 1,
      "type": "database",
      "label": "Context Store",
      "sublabel": "repo + memory",
      "width": 132
    },
    {
      "id": "trace",
      "lane": "tools",
      "col": 2,
      "type": "database",
      "label": "Trace Log",
      "sublabel": "events + output",
      "width": 132
    }
  ],
  "edges": [
    {
      "id": "request-chat",
      "from": "user",
      "to": "chat",
      "variant": "default"
    },
    {
      "id": "plan-request",
      "from": "chat",
      "to": "planner",
      "label": "plan",
      "variant": "emphasis"
    },
    {
      "id": "planner-route",
      "from": "planner",
      "to": "router",
      "variant": "default"
    },
    {
      "id": "approval-check",
      "from": "router",
      "to": "approval",
      "label": "needs approval?",
      "variant": "security"
    },
    {
      "id": "approved-tool",
      "from": "approval",
      "to": "tool",
      "variant": "emphasis"
    },
    {
      "id": "approval-denied",
      "from": "approval",
      "to": "blocked",
      "label": "denied",
      "variant": "security",
      "role": "error"
    },
    {
      "id": "retry-request",
      "from": "blocked",
      "to": "retry",
      "variant": "dashed",
      "role": "branch"
    },
    {
      "id": "tool-external-call",
      "from": "tool",
      "to": "external",
      "variant": "default"
    },
    {
      "id": "external-reply",
      "from": "external",
      "to": "final",
      "variant": "emphasis",
      "role": "return",
      "fromSide": "right",
      "toSide": "right",
      "route": "outside-right",
      "width": 1.2
    },
    {
      "id": "record-result",
      "from": "external",
      "to": "trace",
      "label": "record result",
      "variant": "dashed",
      "fromSide": "bottom",
      "toSide": "bottom",
      "route": "bottom-channel",
      "labelSegment": 1
    },
    {
      "id": "write-trace-memory",
      "from": "store",
      "to": "trace",
      "label": "trace + memory",
      "variant": "dashed"
    }
  ],
  "cards": [
    {
      "dot": "cyan",
      "title": "Compiler Contract",
      "items": [
        "Lanes and columns determine node placement",
        "Labels reserve clearance; routes stay orthogonal"
      ]
    },
    {
      "dot": "rose",
      "title": "Runtime Semantics",
      "items": [
        "Approval gates risky work before tool execution",
        "Evidence returns through isolated trace and memory"
      ]
    }
  ]
}
